#CODE;ENGLISH;FRENCH;GERMAN;;SPANISH;;;;;;;;;x
EVTDESCwoody.102;Although we have lived in separate settlements in these isles, there has been a great deal of interchange between our peoples. It should be said that though we came with the sword, we have given the Saxons much in the way of culture, and now they seek to emulate us.;;;;;;;;;;;;;x
EVTOPTAwoody.102;Let them, this will only cement our hold on the land!;;;;;;;;;;;;;x
EVTDESCwoody.103;Around our lands more people are using a Norse-influenced dialect, ensuring our continued dominance. We continue to use our own influence to promote this means of communication in the interests of a stronger realm.;;;;;;;;;;;;;x
EVTOPTAwoody.103;We are indeed wise;;;;;;;;;;;;;x
EVTDESCwoody.104;My vassal has spent much time amongst the people and has come to represent a new kind of Anglo-Saxon;;;;;;;;;;;;;x
EVTOPTAwoody.104;A new country indeed!;;;;;;;;;;;;;x
EVTDESCwoody.105;It is impossible to remain apart from the Anglo-Saxons, but we will always look North.;;;;;;;;;;;;;x
EVTOPTAwoody.105;Canute is still a great name!;;;;;;;;;;;;;x
